{
  "chunk_id": "chunk-007",
  "schema_version": "1.0",
  "segment_range": [
    3001,
    3071
  ],
  "timestamp_range": {
    "start_ms": 17806000,
    "end_ms": 18231500
  },
  "segments": [
    {
      "id": "3001",
      "start_ms": 17806000,
      "end_ms": 17811500,
      "speaker": "Linda Chen",
      "text": "Volunteers coordinate more effectively across locations.",
      "raw_text": "<v Linda Chen>Volunteers coordinate more effectively across locations."
    },
    {
      "id": "3002",
      "start_ms": 17812000,
      "end_ms": 17817500,
      "speaker": "Linda Chen",
      "text": "Donor communication improved significantly.",
      "raw_text": "<v Linda Chen>Donor communication improved significantly."
    },
    {
      "id": "3003",
      "start_ms": 17818000,
      "end_ms": 17823500,
      "speaker": "Linda Chen",
      "text": "They've been able to serve more people with the same resources.",
      "raw_text": "<v Linda Chen>They've been able to serve more people with the same resources."
    },
    {
      "id": "3004",
      "start_ms": 17824000,
      "end_ms": 17829500,
      "speaker": "Linda Chen",
      "text": "These impact stories motivate everything we do.",
      "raw_text": "<v Linda Chen>These impact stories motivate everything we do."
    },
    {
      "id": "3005",
      "start_ms": 17830000,
      "end_ms": 17835500,
      "speaker": "Diana Martinez",
      "text": "Let me showcase a few more innovations from our labs.",
      "raw_text": "<v Diana Martinez>Let me showcase a few more innovations from our labs."
    },
    {
      "id": "3006",
      "start_ms": 17836000,
      "end_ms": 17841500,
      "speaker": "Diana Martinez",
      "text": "Project Compass uses AI to help navigate complex information.",
      "raw_text": "<v Diana Martinez>Project Compass uses AI to help navigate complex information."
    },
    {
      "id": "3007",
      "start_ms": 17842000,
      "end_ms": 17847500,
      "speaker": "Diana Martinez",
      "text": "It learns from user behavior to surface relevant content.",
      "raw_text": "<v Diana Martinez>It learns from user behavior to surface relevant content."
    },
    {
      "id": "3008",
      "start_ms": 17848000,
      "end_ms": 17853500,
      "speaker": "Diana Martinez",
      "text": "Information finds users instead of requiring searches.",
      "raw_text": "<v Diana Martinez>Information finds users instead of requiring searches."
    },
    {
      "id": "3009",
      "start_ms": 17854000,
      "end_ms": 17859500,
      "speaker": "Diana Martinez",
      "text": "Project Bridge enables seamless cross-platform experiences.",
      "raw_text": "<v Diana Martinez>Project Bridge enables seamless cross-platform experiences."
    },
    {
      "id": "3010",
      "start_ms": 17860000,
      "end_ms": 17865500,
      "speaker": "Diana Martinez",
      "text": "Users can start on desktop and continue on mobile.",
      "raw_text": "<v Diana Martinez>Users can start on desktop and continue on mobile."
    },
    {
      "id": "3011",
      "start_ms": 17866000,
      "end_ms": 17871500,
      "speaker": "Diana Martinez",
      "text": "Context transfers automatically between devices.",
      "raw_text": "<v Diana Martinez>Context transfers automatically between devices."
    },
    {
      "id": "3012",
      "start_ms": 17872000,
      "end_ms": 17877500,
      "speaker": "Diana Martinez",
      "text": "Project Shield adds advanced security capabilities.",
      "raw_text": "<v Diana Martinez>Project Shield adds advanced security capabilities."
    },
    {
      "id": "3013",
      "start_ms": 17878000,
      "end_ms": 17883500,
      "speaker": "Diana Martinez",
      "text": "Behavioral analysis detects unusual account activity.",
      "raw_text": "<v Diana Martinez>Behavioral analysis detects unusual account activity."
    },
    {
      "id": "3014",
      "start_ms": 17884000,
      "end_ms": 17889500,
      "speaker": "Diana Martinez",
      "text": "Automated responses contain potential threats quickly.",
      "raw_text": "<v Diana Martinez>Automated responses contain potential threats quickly."
    },
    {
      "id": "3015",
      "start_ms": 17890000,
      "end_ms": 17895500,
      "speaker": "Diana Martinez",
      "text": "Project Harmony focuses on accessibility innovations.",
      "raw_text": "<v Diana Martinez>Project Harmony focuses on accessibility innovations."
    },
    {
      "id": "3016",
      "start_ms": 17896000,
      "end_ms": 17901500,
      "speaker": "Diana Martinez",
      "text": "AI generates accurate descriptions for visual content.",
      "raw_text": "<v Diana Martinez>AI generates accurate descriptions for visual content."
    },
    {
      "id": "3017",
      "start_ms": 17902000,
      "end_ms": 17907500,
      "speaker": "Diana Martinez",
      "text": "Voice control enables hands-free navigation.",
      "raw_text": "<v Diana Martinez>Voice control enables hands-free navigation."
    },
    {
      "id": "3018",
      "start_ms": 17908000,
      "end_ms": 17913500,
      "speaker": "Diana Martinez",
      "text": "Project Echo explores advanced voice and speech features.",
      "raw_text": "<v Diana Martinez>Project Echo explores advanced voice and speech features."
    },
    {
      "id": "3019",
      "start_ms": 17914000,
      "end_ms": 17919500,
      "speaker": "Diana Martinez",
      "text": "Natural language understanding becomes more sophisticated.",
      "raw_text": "<v Diana Martinez>Natural language understanding becomes more sophisticated."
    },
    {
      "id": "3020",
      "start_ms": 17920000,
      "end_ms": 17925500,
      "speaker": "Diana Martinez",
      "text": "Meeting transcription and summarization improve continuously.",
      "raw_text": "<v Diana Martinez>Meeting transcription and summarization improve continuously."
    },
    {
      "id": "3021",
      "start_ms": 17926000,
      "end_ms": 17931500,
      "speaker": "Diana Martinez",
      "text": "Project Prism explores data visualization innovations.",
      "raw_text": "<v Diana Martinez>Project Prism explores data visualization innovations."
    },
    {
      "id": "3022",
      "start_ms": 17932000,
      "end_ms": 17937500,
      "speaker": "Diana Martinez",
      "text": "Complex data becomes understandable through smart visualization.",
      "raw_text": "<v Diana Martinez>Complex data becomes understandable through smart visualization."
    },
    {
      "id": "3023",
      "start_ms": 17938000,
      "end_ms": 17943500,
      "speaker": "Diana Martinez",
      "text": "Insights emerge from patterns that were previously hidden.",
      "raw_text": "<v Diana Martinez>Insights emerge from patterns that were previously hidden."
    },
    {
      "id": "3024",
      "start_ms": 17944000,
      "end_ms": 17949500,
      "speaker": "Diana Martinez",
      "text": "These projects represent our investment in the future.",
      "raw_text": "<v Diana Martinez>These projects represent our investment in the future."
    },
    {
      "id": "3025",
      "start_ms": 17950000,
      "end_ms": 17955500,
      "speaker": "Diana Martinez",
      "text": "Some will become products; others inform our thinking.",
      "raw_text": "<v Diana Martinez>Some will become products; others inform our thinking."
    },
    {
      "id": "3026",
      "start_ms": 17956000,
      "end_ms": 17961500,
      "speaker": "Diana Martinez",
      "text": "Innovation requires experimentation and learning.",
      "raw_text": "<v Diana Martinez>Innovation requires experimentation and learning."
    },
    {
      "id": "3027",
      "start_ms": 17962000,
      "end_ms": 17967500,
      "speaker": "Employee Twenty Nine",
      "text": "How do we measure the success of our culture initiatives?",
      "raw_text": "<v Employee Twenty Nine>How do we measure the success of our culture initiatives?"
    },
    {
      "id": "3028",
      "start_ms": 17968000,
      "end_ms": 17973500,
      "speaker": "Sarah Mitchell",
      "text": "We use multiple metrics to assess cultural health.",
      "raw_text": "<v Sarah Mitchell>We use multiple metrics to assess cultural health."
    },
    {
      "id": "3029",
      "start_ms": 17974000,
      "end_ms": 17979500,
      "speaker": "Sarah Mitchell",
      "text": "Employee engagement surveys happen twice yearly.",
      "raw_text": "<v Sarah Mitchell>Employee engagement surveys happen twice yearly."
    },
    {
      "id": "3030",
      "start_ms": 17980000,
      "end_ms": 17985500,
      "speaker": "Sarah Mitchell",
      "text": "Pulse surveys track sentiment more frequently.",
      "raw_text": "<v Sarah Mitchell>Pulse surveys track sentiment more frequently."
    },
    {
      "id": "3031",
      "start_ms": 17986000,
      "end_ms": 17991500,
      "speaker": "Sarah Mitchell",
      "text": "Retention rates indicate whether people want to stay.",
      "raw_text": "<v Sarah Mitchell>Retention rates indicate whether people want to stay."
    },
    {
      "id": "3032",
      "start_ms": 17992000,
      "end_ms": 17997500,
      "speaker": "Sarah Mitchell",
      "text": "Internal promotion rates show career development success.",
      "raw_text": "<v Sarah Mitchell>Internal promotion rates show career development success."
    },
    {
      "id": "3033",
      "start_ms": 17998000,
      "end_ms": 18003500,
      "speaker": "Sarah Mitchell",
      "text": "Referral rates indicate whether employees recommend us.",
      "raw_text": "<v Sarah Mitchell>Referral rates indicate whether employees recommend us."
    },
    {
      "id": "3034",
      "start_ms": 18004000,
      "end_ms": 18009500,
      "speaker": "Sarah Mitchell",
      "text": "Glassdoor and other public reviews provide external perspective.",
      "raw_text": "<v Sarah Mitchell>Glassdoor and other public reviews provide external perspective."
    },
    {
      "id": "3035",
      "start_ms": 18010000,